{
  "schemaVersion": "1.0.0",
  "description": "Public catalog of deterministic rules shipped with AIsec. Evidence levels describe the default static signal, while applicability and review fields document bounded coverage rather than exploitability or certification.",
  "applicabilityProfiles": [
    {
      "id": "generic-source",
      "languages": ["Selected text source and configuration files"],
      "technologies": [{ "name": "Generic source files", "versionRange": "*", "basis": "syntax" }],
      "versionStatement": "No package-version gate is applied; only the documented credential or source-code syntax is recognized."
    },
    {
      "id": "javascript-typescript",
      "languages": ["JavaScript", "JSX", "TypeScript", "TSX"],
      "technologies": [{ "name": "JavaScript/TypeScript syntax", "versionRange": "*", "basis": "syntax" }],
      "versionStatement": "No runtime or framework semver is inferred; the bounded TypeScript parser and recognized local syntax determine coverage."
    },
    {
      "id": "nextjs-app-router",
      "languages": ["JavaScript", "TypeScript"],
      "technologies": [{ "name": "Next.js App Router", "versionRange": "*", "basis": "syntax" }],
      "versionStatement": "Applies to recognized app/api/**/route source layout and exported HTTP handlers without checking the installed Next.js version."
    },
    {
      "id": "github-actions",
      "languages": ["GitHub Actions YAML"],
      "technologies": [{ "name": "GitHub Actions workflow syntax", "versionRange": "*", "basis": "configuration" }],
      "versionStatement": "GitHub Actions is not package-versioned; coverage is limited to recognized workflow run-step expression syntax."
    },
    {
      "id": "fastapi",
      "languages": ["Python"],
      "technologies": [{ "name": "FastAPI", "versionRange": "*", "basis": "syntax" }],
      "versionStatement": "No FastAPI dependency range is asserted; only statically resolved decorators, routers, dependencies and middleware patterns are covered."
    },
    {
      "id": "express",
      "languages": ["JavaScript", "TypeScript"],
      "technologies": [{ "name": "Express", "versionRange": "*", "basis": "syntax" }],
      "versionStatement": "No Express dependency range is asserted; only bounded static router, middleware, controller and local-call patterns are covered."
    },
    {
      "id": "nestjs",
      "languages": ["TypeScript", "JavaScript"],
      "technologies": [{ "name": "NestJS", "versionRange": "*", "basis": "syntax" }],
      "versionStatement": "No NestJS dependency range is asserted; only bounded official decorators, module graphs, bootstrap calls, RouterModule trees and local-call patterns are covered."
    },
    {
      "id": "python-source",
      "languages": ["Python"],
      "technologies": [{ "name": "Python source syntax", "versionRange": "*", "basis": "syntax" }],
      "versionStatement": "No Python runtime version is inferred; coverage depends on the bounded recognized source syntax and local call graph."
    },
    {
      "id": "jwt-configuration",
      "languages": ["YAML", "JSON", "TOML", "environment-style configuration"],
      "technologies": [{ "name": "JWT application configuration", "versionRange": "*", "basis": "configuration" }],
      "versionStatement": "No JWT library version is inferred; only recognized production-named configuration keys and literal values are evaluated."
    },
    {
      "id": "docker-compose-fastapi",
      "languages": ["Docker Compose YAML", "Python"],
      "technologies": [
        { "name": "Docker Compose", "versionRange": "*", "basis": "configuration" },
        { "name": "FastAPI", "versionRange": "*", "basis": "syntax" }
      ],
      "versionStatement": "Coverage correlates recognized Compose port publication with statically visible FastAPI routes; neither dependency nor Compose schema semver is used as a gate."
    },
    {
      "id": "supabase-postgres",
      "languages": ["PostgreSQL SQL"],
      "technologies": [{ "name": "Supabase/PostgreSQL RLS migrations", "versionRange": "*", "basis": "configuration" }],
      "versionStatement": "No Supabase or PostgreSQL version is inferred; only scanned migration statements and recognized RLS policy syntax are evaluated."
    },
    {
      "id": "firebase-rules",
      "languages": ["Firebase Security Rules"],
      "technologies": [{ "name": "Cloud Firestore/Storage Security Rules", "versionRange": "*", "basis": "configuration" }],
      "versionStatement": "Rules-version declarations are not used as a gate; coverage is limited to recognized allow expressions, direct single-return local helpers and visible Storage upload-size checks in scanned rule files."
    },
    {
      "id": "android-manifest",
      "languages": ["AndroidManifest XML"],
      "technologies": [{ "name": "Android manifest", "versionRange": "*", "basis": "configuration" }],
      "versionStatement": "Android API level is not inferred; the rule reports recognized effective-looking manifest attributes and requires build-variant review."
    },
    {
      "id": "ios-plist",
      "languages": ["Apple property-list XML"],
      "technologies": [{ "name": "iOS Info.plist", "versionRange": "*", "basis": "configuration" }],
      "versionStatement": "iOS deployment target is not inferred; coverage is limited to recognized App Transport Security keys in scanned property lists."
    },
    {
      "id": "mobile-webview-source",
      "languages": ["Java", "Kotlin", "JavaScript", "TypeScript"],
      "technologies": [{ "name": "Android/React Native WebView source", "versionRange": "*", "basis": "syntax" }],
      "versionStatement": "Framework and platform versions are not inferred; only recognized JavaScript/bridge enablement syntax is reported."
    },
    {
      "id": "mobile-source",
      "languages": ["Java", "Kotlin", "JavaScript", "TypeScript", "Dart"],
      "technologies": [{ "name": "Mobile application source", "versionRange": "*", "basis": "syntax" }],
      "versionStatement": "Platform and framework versions are not inferred; only recognized production-looking cleartext URL literals are reported."
    },
    {
      "id": "react-native",
      "languages": ["JavaScript", "TypeScript"],
      "technologies": [{ "name": "React Native AsyncStorage", "versionRange": "*", "basis": "syntax" }],
      "versionStatement": "No React Native or AsyncStorage version is inferred; coverage is limited to recognized sensitive-key setItem calls."
    },
    {
      "id": "flutter",
      "languages": ["Dart"],
      "technologies": [{ "name": "Flutter/Dart mobile source", "versionRange": "*", "basis": "syntax" }],
      "versionStatement": "No Flutter or package version is inferred; coverage is limited to recognized SharedPreferences, WebView and TLS callback syntax."
    },
    {
      "id": "mobile-artifact",
      "languages": ["APK/IPA bounded printable resources"],
      "technologies": [
        { "name": "Android APK", "versionRange": "*", "basis": "artifact" },
        { "name": "iOS IPA", "versionRange": "*", "basis": "artifact" }
      ],
      "versionStatement": "Platform versions are not inferred; only bounded selected resources and printable strings from validated archives are inspected."
    },
    {
      "id": "opengrep-javascript",
      "languages": ["JavaScript", "TypeScript"],
      "technologies": [{ "name": "Bundled Opengrep rule syntax", "versionRange": "1.26.0", "basis": "engine" }],
      "versionStatement": "The bundled rule is integration-tested with the single verified Opengrep version declared by AIsec."
    },
    {
      "id": "opengrep-python",
      "languages": ["Python"],
      "technologies": [{ "name": "Bundled Opengrep rule syntax", "versionRange": "1.26.0", "basis": "engine" }],
      "versionStatement": "The bundled rule is integration-tested with the single verified Opengrep version declared by AIsec."
    },
    {
      "id": "opengrep-multilang",
      "languages": ["JavaScript", "TypeScript", "Python", "Java", "Go"],
      "technologies": [{ "name": "Bundled Opengrep rule syntax", "versionRange": "1.26.0", "basis": "engine" }],
      "versionStatement": "The bundled rule is integration-tested with the single verified Opengrep version declared by AIsec."
    }
  ],
  "rules": [
    {
      "ruleId": "secret.stripe-live",
      "source": "native",
      "category": "secrets",
      "summary": "Stripe live secret key in source",
      "cwe": ["CWE-798"],
      "defaultEvidenceLevel": "static_confirmed",
      "applicability": ["generic-source"],
      "falsePositiveModes": ["A credential-shaped value may be synthetic, revoked or isolated to a fixture."],
      "reviewGuidance": "Confirm provenance without sending the key, revoke any real credential, and inspect source history and built client assets."
    },
    {
      "ruleId": "secret.openai",
      "source": "native",
      "category": "secrets",
      "summary": "OpenAI API key in source",
      "cwe": ["CWE-798"],
      "defaultEvidenceLevel": "static_confirmed",
      "applicability": ["generic-source"],
      "falsePositiveModes": ["A credential-shaped value may be synthetic, revoked or isolated to a fixture."],
      "reviewGuidance": "Confirm provenance without sending the key, revoke any real credential, and inspect source history and distributed bundles."
    },
    {
      "ruleId": "secret.aws-access-key",
      "source": "native",
      "category": "secrets",
      "summary": "AWS access key in source",
      "cwe": ["CWE-798"],
      "defaultEvidenceLevel": "static_confirmed",
      "applicability": ["generic-source"],
      "falsePositiveModes": ["The identifier may be synthetic, revoked or a non-authentic documentation example."],
      "reviewGuidance": "Verify through account inventory rather than authentication attempts, rotate if real, and check paired secrets and Git history."
    },
    {
      "ruleId": "secret.github-token",
      "source": "native",